<!ELEMENT softwarelist (software+)>
<!ATTLIST softwarelist name CDATA #REQUIRED>
<!ATTLIST softwarelist description CDATA #IMPLIED>
<!ELEMENT software (description, year?, publisher, part*)>
<!ATTLIST software name CDATA #REQUIRED>
<!ATTLIST software cloneof CDATA #IMPLIED>
<!ATTLIST software supported (yes|partial|no) "yes">
<!ELEMENT description (#PCDATA)>
<!ELEMENT year (#PCDATA)>
<!ELEMENT publisher (#PCDATA)>
<!ELEMENT part (feature*, dataarea*)>
<!ATTLIST part name CDATA #REQUIRED>
<!ATTLIST part interface CDATA #REQUIRED>
<!-- feature is used to store things like pcb-type, mapper type, etc. Specific values depend on the system. -->
<!ELEMENT feature EMPTY>
<!ATTLIST feature name CDATA #REQUIRED>
<!ATTLIST feature value CDATA #IMPLIED>
<!ELEMENT dataarea (rom*)>
<!ATTLIST dataarea name CDATA #REQUIRED>
<!ATTLIST dataarea size CDATA #REQUIRED>
<!ATTLIST dataarea databits (8|16|32|64) "8">
<!ATTLIST dataarea endian (big|little) "little">
<!ELEMENT rom EMPTY>
<!ATTLIST rom name CDATA #IMPLIED>
<!ATTLIST rom size CDATA #IMPLIED>
<!ATTLIST rom crc CDATA #IMPLIED>
<!ATTLIST rom md5 CDATA #IMPLIED>
<!ATTLIST rom sha1 CDATA #IMPLIED>
<!ATTLIST rom offset CDATA #IMPLIED>
<!ATTLIST rom value CDATA #IMPLIED>
<!ATTLIST rom status (baddump|nodump|good) "good">
<!ATTLIST rom loadflag (load16_byte|load16_word|load16_word_swap|load32_byte|load32_word|load32_word_swap|load32_dword|load64_word|load64_word_swap|reload|fill|continue) #IMPLIED>
