<?xml version="1.0"?>
<!DOCTYPE softwarelist SYSTEM "softwarelist.dtd">
<softwarelist name="juicebox" description="Mattel Juice Box SmartMedia Flash ROM">
	<software name="kidsnedo">
		<description>Codename: Kids Next Door</description>
		<year>2003</year>
		<publisher>Cartoon Network</publisher>
		<part name="memc" interface="smartmedia">
			<dataarea name="rom" size="34604032">
				<rom name="kidsnedo.smc" size="34604032" crc="e917e1f2" sha1="42c56a8b9a2ae076956b98e8bd71e1dfd841d002" offset="0x00000" />
			</dataarea>
		</part>
	</software>
	<software name="yugioh">
		<description>Yu-Gi-Oh!</description>
		<year>1996</year>
		<publisher>Kazuki Takahashi</publisher>
		<part name="memc" interface="smartmedia">
			<dataarea name="rom" size="34604032">
				<rom name="yugioh.smc" size="34604032" crc="0a97c7d6" sha1="1b2375c9ef1bbd5cae0c3f0ac20511a36523e86a" offset="0x00000"/>
			</dataarea>
		</part>
	</software>
</softwarelist>
