<?xml version="1.0"?>
<!DOCTYPE softwarelist SYSTEM "softwarelist.dtd">
<!-- Software from here: http://rainbow-100.com -->

<softwarelist name="rainbow" description="DEC Rainbow 100 Disk Images">
	<software name="concpm86">
		<description>Concurrent CP/M-86</description>
		<year>198?</year>
		<publisher>Digital Research</publisher>
		<part name="flop1" interface="floppy_5_25">
			<feature name="part_id" value="Boot Disk"/>
			<dataarea name="flop" size="309260">
				<rom name="ccpmsys.td0" size="309260" crc="4b175438" sha1="948ec04358d2adf05f2c077556e2bd899e87cbca" offset="0" />
			</dataarea>
		</part>
		<part name="flop2" interface="floppy_5_25">
			<feature name="part_id" value="Utilities Disk"/>
			<dataarea name="flop" size="322414">
				<rom name="ccpmutil.td0" size="322414" crc="f4b7332b" sha1="0e844b8c835370e2f8f095b0dc84dfdb7bc2135f" offset="0" />
			</dataarea>
		</part>
		<part name="flop3" interface="floppy_5_25">
			<feature name="part_id" value="Graphics Disk"/>
			<dataarea name="flop" size="193193">
				<rom name="ccpmgsx.td0" size="193193" crc="62c0668b" sha1="84ed7179defc3ee513c600cbd97078da2b529705" offset="0" />
			</dataarea>
		</part>
	</software>

	<software name="cpm8011">
		<description>CP/M-86/80 (Version 1.1)</description>
		<year>198?</year>
		<publisher>Digital Research</publisher>
		<part name="flop1" interface="floppy_5_25">
			<dataarea name="flop" size="204393">
				<rom name="cpmv11.td0" size="204393" crc="38f9ad05" sha1="ec39d974cdb757573ce026de84056dad08df3ce3a" offset="0" />
			</dataarea>
		</part>
	</software>

	<software name="cpm8021">
		<description>CP/M-86/80 (Version 2.1)</description>
		<year>198?</year>
		<publisher>Digital Research</publisher>
		<part name="flop1" interface="floppy_5_25">
			<dataarea name="flop" size="342476">
				<rom name="cpmv21.td0" size="342476" crc="efb74351" sha1="4ef27aff24793f0dfcdc38b1bb8238994d439eec" offset="0" />
			</dataarea>
		</part>
	</software>

	<software name="msdos201">
		<description>MS-DOS 2.01</description>
		<year>198?</year>
		<publisher>Microsoft</publisher>
		<part name="flop1" interface="floppy_5_25">
			<dataarea name="flop" size="208780">
				<rom name="msdos201.td0" size="208780" crc="7d652459" sha1="cb2f6f4a181032f69bdf339f2555dcfdfd1e7ef7" offset="0" />
			</dataarea>
		</part>
	</software>

	<software name="msdos211">
		<description>MS-DOS 2.11</description>
		<year>198?</year>
		<publisher>Microsoft</publisher>
		<part name="flop1" interface="floppy_5_25">
			<dataarea name="flop" size="409600">
				<rom name="msdos211.img" size="409600" crc="52f98712" sha1="83608857b38351fff99d65bb28b7cf8454668bbb" offset="0" />
			</dataarea>
		</part>
	</software>

	<software name="msdos31b">
		<description>MS-DOS 3.10b</description>
		<year>198?</year>
		<publisher>Microsoft</publisher>
		<part name="flop1" interface="floppy_5_25">
			<dataarea name="flop" size="338752">
				<rom name="msdos31b.td0" size="338752" crc="d12d5719" sha1="ec0c50ba812b45cc22503f2611e7abbcd8ba54f8" offset="0" />
			</dataarea>
		</part>
	</software>

	<software name="psystem">
		<description>p-System</description>
		<year>198?</year>
		<publisher>UCSD</publisher>
		<!-- Looking at the Disk image with a hex editor it says 1982 by SofTech Microsystems, Inc. will wait till emulation is of such state to enable it too boot before fixing this -->
		<!-- The Order of these needs to be sorted later-->
		<part name="flop1" interface="floppy_5_25">
			<dataarea name="flop" size="409600">
				<rom name="8086kit.img" size="409600" crc="64577e4f" sha1="ee4ba05bd8fbce8cac609589fc031cb5e0073564" offset="0" />
			</dataarea>
		</part>
		<part name="flop2" interface="floppy_5_25">
			<dataarea name="flop" size="409600">
				<rom name="fort_sys.img" size="409600" crc="d3ec79b2" sha1="96ac1bc6ffdb4067ec17b777ff1fb1dffcfbc958" offset="0" />
			</dataarea>
		</part>
		<part name="flop3" interface="floppy_5_25">
			<dataarea name="flop" size="409600">
				<rom name="pas_sys.img" size="409600" crc="302ecaf5" sha1="8e5b63ba1afde500c93431d96039811544a08ce3" offset="0" />
			</dataarea>
		</part>
		<part name="flop4" interface="floppy_5_25">
			<dataarea name="flop" size="409600">
				<rom name="pascal.img" size="409600" crc="42f485ad" sha1="f9ca68a56f598a1ad59ad8916635305a2cafa7bd" offset="0" />
			</dataarea>
		</part>
		<part name="flop5" interface="floppy_5_25">
			<dataarea name="flop" size="409600">
				<rom name="toolkit.img" size="409600" crc="a23b3aa0" sha1="07be31bec922697f337a5c2dfab1eb4125cf6e86" offset="0" />
			</dataarea>
		</part>
		<part name="flop6" interface="floppy_5_25">
			<dataarea name="flop" size="409600">
				<rom name="utils.img" size="409600" crc="45642488" sha1="912af05ed55b73a5b456d6e3166d9af576f3e60b" offset="0" />
			</dataarea>
		</part>
	</software>
</softwarelist>
