<?xml version="1.0"?>
<!DOCTYPE softwarelist SYSTEM "softwarelist.dtd">
<softwarelist name="plus4_cart" description="Commodore Plus/4 cartridges">
	
	<!-- Games -->
	
	<software name="atomicmi">
		<description>Atomic Mission</description>
		<year>1984</year>
		<publisher>Commodore</publisher>
		<info name="serial" value="T116005" />
		<part name="cart" interface="plus4_cart">
			<dataarea name="c1l" size="0x4000">
				<rom name="atomic-lo" size="0x2000" crc="8ee859ce" sha1="dac80035aa9c15c81d0ae7d80392d2be691dd55c" offset="0x0000" />
				<rom name="atomic-hi" size="0x2000" crc="f3ebd401" sha1="011b7fd7c7990c4189ac107f7da0f3df474007d1" offset="0x2000" />
			</dataarea>
		</part>
	</software>
	
	<software name="jackattk">
		<description>Jack Attack</description>
		<year>1984</year>
		<publisher>Commodore</publisher>
		<info name="serial" value="T116002" />
		<part name="cart" interface="plus4_cart">
			<dataarea name="c1l" size="0x4000">
				<rom name="jack-lo" size="0x2000" crc="c4201b23" sha1="dfba1151dc477d1096d5e4747fe07c104454d9ad" offset="0x0000" />
				<rom name="jack-hi" size="0x2000" crc="f67be343" sha1="c6ef59735d11a85538538c868dfc09c970070ab5" offset="0x2000" />
			</dataarea>
		</part>
	</software>
	
	<software name="piratead">
		<description>Pirate Adventure</description>
		<year>1984</year>
		<publisher>Commodore</publisher>
		<info name="serial" value="T116004" />
		<part name="cart" interface="plus4_cart">
			<dataarea name="c1l" size="0x4000">
				<rom name="pirate-lo" size="0x2000" crc="636ac403" sha1="45e3fa723bc58b1c2c0ff4ac428556629fc384bf" offset="0x0000" />
				<rom name="pirate-hi" size="0x2000" crc="d66c86e9" sha1="44d56f6fd32b5ba8202f674444a5bc4e7481ceb4" offset="0x2000" />
			</dataarea>
		</part>
	</software>
	
	<software name="strngeod">
		<description>Strange Odyssey</description>
		<year>1984</year>
		<publisher>Commodore</publisher>
		<info name="serial" value="T116006" />
		<part name="cart" interface="plus4_cart">
			<dataarea name="c1l" size="0x4000">
				<rom name="odyssey-lo" size="0x2000" crc="2a55241b" sha1="0fe437bae5b07a81aa8abf7496a685ba5bbf0e41" offset="0x0000" />
				<rom name="odyssey-hi" size="0x2000" crc="ca728068" sha1="78a087b731051b688ad572f80d0af15c01a44193" offset="0x2000" />
			</dataarea>
		</part>
	</software>

	<!-- Applications -->
	
	<software name="speedfrz" supported="no">
		<description>Speedy Freeze</description>
		<year>1988</year>
		<publisher>&lt;unknown&gt;</publisher>
		<part name="cart" interface="plus4_cart">
			<dataarea name="c1l" size="0x4000">
				<rom name="speedy.u1" size="0x2000" crc="74f180bc" sha1="79a4b19c50bc9a85c0356a3d2d7453b2d1d8266f" offset="0x0000" />
			</dataarea>
		</part>
	</software>

</softwarelist>
