<?xml version="1.0"?>
<!DOCTYPE softwarelist SYSTEM "softwarelist.dtd">
<!--  Needed to be dump:
	IBM PCjr club disk library (only an extracted collection exist)
-->
<softwarelist name="ibmpcjr_flop" description="IBM PCjr disk images">
	<software name="dos2">
		<description>IBM PC-DOS Version 2.00</description>
		<year>1983</year>
		<publisher>IBM</publisher>
		<part name="flop1" interface="floppy_5_25">
			<dataarea name="flop" size="368640">
				<rom name="dos2.ima" size="368640" crc="d0fb7d31" sha1="cbee7f6109fb0ed8a94de1893fc47ab066de36d3" offset="0x00000" />
			</dataarea>
		</part>
	</software>

	<software name="wordstar">
		<description>Wordstar for PCjr (Release 1.00)</description>
		<year>1987</year>
		<publisher>Micropro International</publisher>
		<part name="flop1" interface="floppy_5_25">
			<dataarea name="flop" size="368640">
				<rom name="disk 1.ima" size="368640" crc="81b95671" sha1="a5f33403b1e3762e6b1c2c84b279e093eec9501f" offset="0x00000" />
			</dataarea>
		</part>
		<part name="flop2" interface="floppy_5_25">
			<dataarea name="flop" size="368640">
				<rom name="disk 2.ima" size="368640" crc="d5c84856" sha1="ef138f490f302e687827b71b8d254143d870f895" offset="0x00000" />
			</dataarea>
		</part>
		<part name="flop3" interface="floppy_5_25">
			<dataarea name="flop" size="368640">
				<rom name="disk 3.ima" size="368640" crc="49884404" sha1="11c8c7d638ba00a1e42844a1efb09fd6f75ac7d4" offset="0x00000" />
			</dataarea>
		</part>
	</software>

	<software name="explore">
		<description>Exploring The IBM PCjr</description>
		<year>1983</year>
		<publisher>IBM Corp.</publisher>
		<part name="flop1" interface="floppy_5_25">
			<dataarea name="flop" size="163840">
				<rom name="exploring the ibm pcjr.ima" size="163840" crc="409ff73f" sha1="453ae5f3fa7781ece7d421dd973ce54204b9c99d" offset="0x00000" />
			</dataarea>
		</part>
	</software>

	<software name="sampler">
		<description>IBM PCjr Sampler</description>
		<year>198?</year>
		<publisher>IBM</publisher>
		<part name="flop1" interface="floppy_5_25">
			<dataarea name="flop" size="368640">
				<rom name="ibm pcjr sampler.ima" size="368640" crc="d0fb7d31" sha1="cbee7f6109fb0ed8a94de1893fc47ab066de36d3" offset="0x00000" />
			</dataarea>
		</part>
	</software>
</softwarelist>
