<?xml version="1.0"?>
<!DOCTYPE softwarelist SYSTEM "softwarelist.dtd">

<!--

Undumped carts:

 * GPA-107 - Turpin ~ ターピン
 * GPA-108 - ??? [possibly no game used this ID]
 * GPA-110 - Fighting Bug ~ ファイティング バグ
 * GPA-111 - Space Panic ~ スペースパニック
 * GPA-112 - Naughty Boy ~ ノーティーボーイ
 * GPA-113 - ??? [possibly no game used this ID]

-->

<softwarelist name="pv1000" description="Casio PV-1000 cartridges">
	<!-- Serial: GPA-101 - Alt Title: プーヤン -->
	<software name="pooyan">
		<description>Pooyan</description>
		<year>1982</year>
		<publisher>Casio</publisher>
		<part name="cart" interface="pv1000_cart">
			<dataarea name="rom" size="8192">
				<rom name="pooyan.bin" size="8192" crc="bd6edc48" sha1="606b7d603da23e70012b361d7ffb53ea026f88f5" offset="0000" />
			</dataarea>
		</part>
	</software>

	<!-- Serial: GPA-102 - Alt Title: スーパーコブラ -->
	<software name="scobra">
		<description>Super Cobra</description>
		<year>1981</year>
		<publisher>Casio</publisher>
		<part name="cart" interface="pv1000_cart">
			<dataarea name="rom" size="8192">
				<rom name="scobra.bin" size="8192" crc="cdffc2cd" sha1="9e748050ccb0fa948b06346d241dfcd11868e8e2" offset="0000" />
			</dataarea>
		</part>
	</software>

	<!-- Serial: GPA-103 - Alt Title: ツターンカーム -->
	<software name="tutnkham">
		<description>Tutankham</description>
		<year>1982</year>
		<publisher>Casio</publisher>
		<part name="cart" interface="pv1000_cart">
			<dataarea name="rom" size="8192">
				<rom name="tutnkham.bin" size="8192" crc="a0b606d8" sha1="56efa2ab7c4a6db7b44714e46c5bf2ba71983ee8" offset="0000" />
			</dataarea>
		</part>
	</software>

	<!-- Serial: GPA-104 - Alt Title: アミダー -->
	<software name="amidar">
		<description>Amidar</description>
		<year>1982</year>
		<publisher>Casio</publisher>
		<part name="cart" interface="pv1000_cart">
			<dataarea name="rom" size="8192">
				<rom name="amidar.bin" size="8192" crc="c82628cc" sha1="00322d4025fef19728194442f9e06a4cccd01933" offset="0000" />
			</dataarea>
		</part>
	</software>

	<!-- Serial: GPA-105 - Alt Title: ディグダグ -->
	<software name="digdug" supported="no">
		<description>Dig Dug</description>
		<year>1982</year>
		<publisher>Casio</publisher>
		<part name="cart" interface="pv1000_cart">
			<dataarea name="rom" size="16384">
				<rom name="digdug.bin" size="16384" crc="a94f02fa" sha1="502a163c1ae88eccc7e9782261d86d4090cb41e1" offset="0000" />
			</dataarea>
		</part>
	</software>

	<!-- Serial: GPA-106 - Alt Title: ワープ＆ワープ -->
	<software name="warpwarp">
		<description>Warp &amp; Warp</description>
		<year>1981</year>
		<publisher>Casio</publisher>
		<part name="cart" interface="pv1000_cart">
			<dataarea name="rom" size="8192">
				<rom name="warpwarp.bin" size="8192" crc="2a0d4ad9" sha1="f9ffca3a1d85b116dd92f118f9ea940bf2449db5" offset="0000" />
			</dataarea>
		</part>
	</software>

	<!-- Serial: GPA-109 - Alt Title: パチンコＵＦＯ -->
	<software name="pchnkufo" supported="no">
		<description>Pachinko-UFO</description>
		<year>1982</year>
		<publisher>Casio</publisher>
		<part name="cart" interface="pv1000_cart">
			<dataarea name="rom" size="16384">
				<rom name="pchnkufo.bin" size="16384" crc="9ee981ab" sha1="d6ca45430a34ce0090ba882ade5a2268a862d4f4" offset="0000" />
			</dataarea>
		</part>
	</software>

	<!-- Serial: GPA-114 - Alt Title: ダーティー カメレオン -->
	<software name="dirtychm">
		<description>Dirty Chameleon</description>
		<year>198?</year>
		<publisher>Casio</publisher>
		<part name="cart" interface="pv1000_cart">
			<dataarea name="rom" size="8192">
				<rom name="dirtychm.bin" size="8192" crc="8e7fb358" sha1="63e94cc01410aefd59b465105e701330dc13c398" offset="0000" />
			</dataarea>
		</part>
	</software>

	<!-- Serial: GPA-115 - Alt Title: エキサイト麻雀 -->
	<software name="excitemj">
		<description>Excite Mahjong</description>
		<year>1982</year>
		<publisher>Casio</publisher>
		<part name="cart" interface="pv1000_cart">
			<dataarea name="rom" size="16384">
				<rom name="excitemj.bin" size="16384" crc="0d2f829c" sha1="6cc9e5d234bc1b483108ae4dc79d644802a64ef0" offset="0000" />
			</dataarea>
		</part>
	</software>

</softwarelist>
