<?xml version="1.0"?>
<!DOCTYPE softwarelist SYSTEM "softwarelist.dtd">
<softwarelist name="trs80m2" description="Tandy TRS-80 Model II disk images">
	<software name="cpm22">
		<!-- Requires 64K RAM -->
		<description>CP/M 2.2</description>
		<year>1983</year>
		<publisher>Pickles &amp; Trout</publisher>
		<part name="flop" interface="floppy_8">
			<dataarea name="flop" size="318931">
				<rom name="cpm22.imd" size="318931" crc="10bce6d2" sha1="8912ef448725774d8a10bfa484342a8dfa81a824" offset="0" />
			</dataarea>
		</part>
	</software>

	<software name="tdos20">
		<description>TRSDOS v2.0a</description>
		<year>1980</year>
		<publisher>Tandy</publisher>
		<info name="catalog" value="26-4910" />
		<part name="flop1" interface="floppy_8">
			<dataarea name="flop" size="146181">
				<rom name="tdos20a.imd" size="146181" crc="b6d2fa9a" sha1="a93accf032b19cdd0122ccf45ba0af90d44f0f84" offset="0" />
			</dataarea>
		</part>
		<part name="flop2" interface="floppy_8">
			<dataarea name="flop" size="146079">
				<rom name="tdos20b.imd" size="146079" crc="decce25d" sha1="97f06369d66abbd5d46cdc6f5e22c32e04a9d686" offset="0" />
			</dataarea>
		</part>
		<part name="flop3" interface="floppy_8">
			<dataarea name="flop" size="131043">
				<rom name="tdoscalc.imd" size="131043" crc="78c1666e" sha1="72e438da397aac4da099c76860426247440f07fd" offset="0" />
			</dataarea>
		</part>
	</software>

	<software name="profile2">
		<description>PROFILE II</description>
		<year>1980</year>
		<publisher>Tandy</publisher>
		<info name="catalog" value="26-4512" />
		<part name="flop" interface="floppy_8">
			<dataarea name="flop" size="215804">
				<rom name="profile2.imd" size="215804" crc="8997532d" sha1="b0b7c738f5e23b7631741475bec25df2451c2a63" offset="0" />
			</dataarea>
		</part>
	</software>

	<software name="script">
		<description>SCRIPTSIT 2.0</description>
		<year>1981</year>
		<publisher>Tandy</publisher>
		<info name="catalog" value="26-4531" />
		<part name="flop" interface="floppy_8">
			<dataarea name="flop" size="227787">
				<rom name="script.imd" size="227787" crc="1cec0e85" sha1="73bfa56e2382ca04fd42f5b108699a1d9904dba2" offset="0" />
			</dataarea>
		</part>
	</software>
</softwarelist>
